{
  "name": "hugo",
  "description": "Hugo static site generator with Tailwind v4, headless CMS (Sveltia/Tina), Cloudflare deployment. Use for blogs, docs sites, or encountering theme installation, frontmatter, baseURL errors.",
  "version": "3.10.0",
  "author": {
    "name": "Claude Skills Maintainers",
    "email": "maintainers@example.com"
  },
  "license": "MIT",
  "repository": "https://github.com/secondsky/claude-skills",
  "keywords": [
    "hugo",
    "cms",
    "content",
    "management",
    "publishing"
  ]
}
