{
  "name": "google-gemini-file-search",
  "description": "Google Gemini File Search for managed RAG with 100+ file formats. Use for document Q&A, knowledge bases, or encountering immutability errors, quota issues, polling failures. Supports Gemini 3 Pro/Flash (Gemini 2.5 legacy).",
  "version": "3.4.0",
  "author": {
    "name": "Claude Skills Maintainers",
    "email": "maintainers@example.com"
  },
  "license": "MIT",
  "repository": "https://github.com/secondsky/claude-skills",
  "keywords": [
    "google-gemini-file-search",
    "google",
    "gemini",
    "file",
    "search",
    "machine-learning",
    "llm",
    "artificial-intelligence",
    "rag"
  ]
}
