{
  "name": "turborepo",
  "description": "Guide for implementing Turborepo - a high-performance build system for JavaScript and TypeScript monorepos. Use when setting up monorepos, optimizing build performance, implementing task pipelines, configuring caching strategies, or orchestrating tasks across multiple packages.",
  "version": "1.0.0",
  "author": {
    "name": "Claude Skills Maintainers",
    "email": "maintainers@example.com"
  },
  "license": "MIT",
  "repository": "https://github.com/secondsky/claude-skills",
  "keywords": []
}
