{
  "name": "interaction-design",
  "version": "3.11.0",
  "description": "Creates intuitive user experiences through feedback patterns, microinteractions, and accessible interaction design. Use when designing loading states, error handling UX, animation guidelines, or touch interactions.",
  "author": {
    "name": "Claude Skills Maintainers",
    "email": "maintainers@example.com"
  },
  "license": "MIT",
  "repository": "https://github.com/secondsky/claude-skills",
  "keywords": [
    "interaction-design",
    "interaction",
    "design",
    "interface",
    "user-experience"
  ],
  "skills": "./skills/",
  "interface": {
    "displayName": "Interaction Design",
    "shortDescription": "Creates intuitive user experiences through feedback patterns,",
    "longDescription": "Creates intuitive user experiences through feedback patterns, microinteractions, and accessible interaction design. Use when designing loading states, error handling UX, animation guidelines, or touch interactions.",
    "developerName": "Claude Skills Maintainers",
    "category": "Design & UX",
    "capabilities": [
      "Read",
      "Write"
    ],
    "defaultPrompt": [
      "Help me with Interaction Design.",
      "Show me best practices for Interaction Design.",
      "Guide me through using Interaction Design effectively."
    ]
  }
}
