{
  "name": "auth",
  "description": "Authentication and authorization: Better Auth, Clerk, OAuth, session management, and API authentication. Use for implementing user authentication, authorization, SSO, and secure sessions.",
  "version": "3.0.0",
  "author": {
    "name": "Claude Skills Maintainers",
    "email": "maintainers@example.com"
  },
  "license": "MIT",
  "repository": "https://github.com/secondsky/claude-skills",
  "keywords": ["auth", "authentication", "authorization", "better-auth", "clerk", "oauth", "session-management", "security"]
}
