{
  "name": "tanstack",
  "description": "Complete TanStack ecosystem: Query for data fetching/caching, Router for type-safe routing, Start for full-stack React framework, Table for headless tables, and AI for AI chat interfaces. Use for React state management, routing, full-stack development, data tables, and AI integration.",
  "version": "3.0.0",
  "author": {
    "name": "Claude Skills Maintainers",
    "email": "maintainers@example.com"
  },
  "license": "MIT",
  "repository": "https://github.com/secondsky/claude-skills",
  "keywords": ["tanstack", "tanstack-query", "tanstack-router", "tanstack-start", "tanstack-table", "tanstack-ai", "react", "data-fetching", "routing", "tables", "ai", "type-safe"]
}
