{
  "name": "woocommerce-backend-dev",
  "description": "Add or modify WooCommerce backend PHP code following project conventions. Use when creating new classes, methods, hooks, or modifying existing backend code in WooCommerce projects.",
  "version": "3.11.0",
  "author": {
    "name": "Claude Skills Maintainers",
    "email": "maintainers@example.com"
  },
  "license": "MIT",
  "repository": "https://github.com/secondsky/claude-skills",
  "keywords": [
    "woocommerce-backend-dev",
    "woocommerce",
    "backend",
    "dev",
    "wordpress",
    "ecommerce",
    "shop",
    "php"
  ]
}
