{
  "name": "woocommerce-dev-cycle",
  "description": "Run tests, linting, and quality checks for WooCommerce development. Use when running tests, fixing code style, or following the development workflow in WooCommerce projects.",
  "version": "3.11.0",
  "author": {
    "name": "Claude Skills Maintainers",
    "email": "maintainers@example.com"
  },
  "license": "MIT",
  "repository": "https://github.com/secondsky/claude-skills",
  "keywords": [
    "woocommerce-dev-cycle",
    "woocommerce",
    "dev",
    "cycle",
    "wordpress",
    "ecommerce",
    "shop"
  ]
}
