{
  "name": "security-headers-configuration",
  "description": "Configures HTTP security headers to protect against XSS, clickjacking, and MIME sniffing attacks. Use when hardening web applications, passing security audits, or implementing Content Security Policy.",
  "version": "3.11.0",
  "author": {
    "name": "Claude Skills Maintainers",
    "email": "maintainers@example.com"
  },
  "license": "MIT",
  "repository": "https://github.com/secondsky/claude-skills",
  "keywords": [
    "security-headers-configuration",
    "security",
    "headers",
    "configuration",
    "vulnerability",
    "protection",
    "csrf",
    "xss",
    "http",
    "mime"
  ]
}
