{
  "name": "ai-sdk-ui",
  "description": "Vercel AI SDK v5 React hooks (useChat, useCompletion, useObject) for AI chat UIs. Use for React/Next.js apps or stream/parse errors.",
  "version": "3.0.0",
  "author": {
    "name": "Claude Skills Maintainers",
    "email": "maintainers@example.com"
  },
  "license": "MIT",
  "repository": "https://github.com/secondsky/claude-skills",
  "keywords": [
    "ai-sdk-ui",
    "sdk",
    "machine-learning",
    "llm",
    "artificial-intelligence"
  ]
}
