{
  "name": "cloudflare-worker-base",
  "description": "Cloudflare Workers with Hono, Vite, Static Assets. Use for new projects, deployment, or encountering export errors, routing conflicts, HMR crashes.",
  "version": "3.0.0",
  "author": {
    "name": "Claude Skills Maintainers",
    "email": "maintainers@example.com"
  },
  "license": "MIT",
  "repository": "https://github.com/secondsky/claude-skills",
  "keywords": [
    "cloudflare-worker-base",
    "cloudflare",
    "worker",
    "base",
    "workers",
    "edge",
    "wrangler",
    "hmr"
  ]
}
