{
  "name": "better-auth",
  "version": "3.10.0",
  "description": "Skill for integrating Better Auth - comprehensive TypeScript authentication framework for Cloudflare D1, Next.js, Nuxt, and 15+ frameworks. Use when adding auth, encountering D1 adapter errors, or implementing OAuth/2FA/RBAC features.",
  "author": {
    "name": "Claude Skills Maintainers",
    "email": "maintainers@example.com"
  },
  "license": "MIT",
  "repository": "https://github.com/secondsky/claude-skills",
  "keywords": [
    "better-auth",
    "better",
    "auth",
    "authentication",
    "authorization",
    "login",
    "security",
    "session",
    "rbac"
  ],
  "skills": "./skills/",
  "interface": {
    "displayName": "Better Auth",
    "shortDescription": "Skill for integrating Better Auth - comprehensive TypeScript authentication",
    "longDescription": "Skill for integrating Better Auth - comprehensive TypeScript authentication framework for Cloudflare D1, Next.js, Nuxt, and 15+ frameworks. Use when adding auth, encountering D1 adapter errors, or implementing OAuth/2FA/RBAC features.",
    "developerName": "Claude Skills Maintainers",
    "category": "Security & Authentication",
    "capabilities": [
      "Read",
      "Write"
    ],
    "defaultPrompt": [
      "Help me with Better Auth.",
      "Show me best practices for Better Auth.",
      "Guide me through using Better Auth effectively."
    ]
  }
}
