{
  "name": "verification-before-completion",
  "description": "Run verification commands and confirm output before claiming success. Use when about to claim work is complete, fixed, or passing, before committing or creating PRs.",
  "version": "3.4.0",
  "author": {
    "name": "Claude Skills Maintainers",
    "email": "maintainers@example.com"
  },
  "license": "MIT",
  "repository": "https://github.com/secondsky/claude-skills",
  "keywords": [
    "verification-before-completion",
    "verification",
    "before",
    "completion",
    "tooling",
    "workflow"
  ]
}
